{
  "contractVersion": "3.1",
  "repository": "fangxiao-dev/KaiSpan",
  "targetBranch": "origin/develop",
  "implementations": [
    "docs/implementations",
    "docs/platform/*/implementations",
    "docs/domains/*/implementations"
  ],
  "stableDocs": {
    "systemKnowledge": [
      "CONTEXT-MAP.md",
      "docs/README.md",
      "docs/system-knowledge"
    ],
    "contextKnowledge": [
      "docs/platform/*/context",
      "docs/domains/*/context"
    ],
    "moduleKnowledge": [
      "docs/platform/*/module-knowledge",
      "docs/domains/*/module-knowledge"
    ]
  },
  "ignore": [
    {
      "paths": ["docs/epic-plans", "docs/**/hands-on-knowledge", "docs/ideas"],
      "owner": "repo-wide",
      "reason": "not implementation source or stable destination; excluded regardless of context"
    }
  ],
  "records": {
    "pending": "auto",
    "pendingOverrides": {},
    "done": "docs/_backfill/done.json",
    "reports": "docs/_backfill/reports"
  }
}
